{
  "tripName": "Madrid Weekend Explorer",
  "dates": "18 - 20 Sept",
  "baseLocation": {
    "name": "Puerta del Sol (Km Cero)",
    "lat": 40.4169,
    "lng": -3.7038
  },
  "categories": [
    { "id": "airelibre", "name": "Aire Libre & Rutas", "icon": "fa-tree" },
    { "id": "musica", "name": "Música & Festivales", "icon": "fa-music" },
    {
      "id": "karting",
      "name": "Motor & Adrenalina",
      "icon": "fa-flag-checkered"
    },
    {
      "id": "vr",
      "name": "Realidad Virtual & Ocio",
      "icon": "fa-vr-cardboard"
    },
    {
      "id": "escena",
      "name": "Teatro & Musicales",
      "icon": "fa-masks-theater"
    },
    { "id": "arte", "name": "Arte & Museos", "icon": "fa-palette" }
  ],
  "activities": [
    {
      "id": "puerta-sol",
      "title": "Puerta del Sol & Plaza Mayor",
      "category": "airelibre",
      "categoryName": "Icono Urbano",
      "location": "Km Cero y Madrid de los Austrias",
      "lat": 40.4169,
      "lng": -3.7038,
      "transit": "Ubicación inicial de referencia",
      "priceMin": 0,
      "priceMax": 0,
      "priceDisplay": "Gratuito",
      "schedule": "Acceso libre 24/7",
      "summary": "El eje monumental de la capital: el Oso y el Madroño, la Casa de Correos y las terrazas castellanas.",
      "description": "Perfecto para comenzar cualquier mañana o disfrutar de la animación nocturna. Al lado se encuentran tabernas castizas con bocadillos de calamares.",
      "tip": "Fotografía la placa del Kilómetro 0 frente a la Casa de Correos temprano por la mañana sin aglomeraciones."
    },
    {
      "id": "free-tour-nocturno",
      "title": "Free Tour Nocturno: Madrid Iluminado",
      "category": "airelibre",
      "categoryName": "Ruta Guiada",
      "location": "Puerta del Sol (Estatua Carlos III)",
      "lat": 40.4169,
      "lng": -3.7036,
      "transit": "Salida directa en la misma plaza de Sol",
      "priceMin": 0,
      "priceMax": 0,
      "priceDisplay": "Gratuito (propina libre)",
      "schedule": "Vie 18, Sáb 19 y Dom 20 a las 19:30 h y 21:00 h",
      "summary": "Recorrido nocturno de 2 horas por fachadas iluminadas, misterios de la Inquisición y leyendas urbanas.",
      "description": "Permite contemplar la monumentalidad del Madrid histórico iluminado al anochecer. Conecta la Plaza Mayor, la Plaza de la Villa y el Palacio Real.",
      "tip": "Reserva tu plaza con antelación en Civitatis para asegurar cupo en el pase de las 19:30 h."
    },
    {
      "id": "free-tour-austrias",
      "title": "Free Tour del Madrid de los Austrias (SANDEMANS)",
      "category": "airelibre",
      "categoryName": "Ruta Histórica",
      "location": "Plaza Mayor (Estatua Felipe III)",
      "lat": 40.4155,
      "lng": -3.7074,
      "transit": "4 min a pie desde Sol por calle Mayor",
      "priceMin": 0,
      "priceMax": 0,
      "priceDisplay": "Gratuito (propina libre)",
      "schedule": "Pases diarios a las 10:00 h, 14:00 h y 15:00 h",
      "summary": "Paseo a pie documentado por la dinastía Habsburgo, la muralla medieval y el Palacio Real.",
      "description": "La mejor toma de contacto para ubicarse en la capital: 2,5 horas de recorrido peatonal explorando la arquitectura del Siglo de Oro y la Plaza de la Villa.",
      "tip": "El turno de las 10:00 h de la mañana es ideal para orientarte antes de ir de tapas por la zona centro."
    },
    {
      "id": "la-yegros",
      "title": "La Yegros en Concierto (Nu-Cumbia)",
      "category": "musica",
      "categoryName": "Concierto Latino",
      "location": "Teatro Eslava (Calle Arenal 11)",
      "lat": 40.4172,
      "lng": -3.7061,
      "transit": "2 min a pie desde Sol",
      "priceMin": 18,
      "priceMax": 24,
      "priceDisplay": "18 - 24 €",
      "schedule": "Viernes 18 de Septiembre (21:00 h)",
      "summary": "La reina de la cumbia experimental argentina llena el mítico Teatro Eslava con fiesta bailable.",
      "description": "Fusión de folclore tradicional sudamericano, chamamé y electrónica contemporánea en un formato dinámico.",
      "tip": "Llega antes de las 20:30 h para coger buena ubicación en la pista frente al escenario."
    },
    {
      "id": "ciclo-mazo",
      "title": "Ciclo MAZO: Pedro Ladroga & CORTE!",
      "category": "musica",
      "categoryName": "Vanguardia Urbana",
      "location": "Sala El Sol / Sala Copérnico",
      "lat": 40.419,
      "lng": -3.7011,
      "transit": "4 min a pie (El Sol) / Metro L3 Moncloa (Copérnico)",
      "priceMin": 14,
      "priceMax": 18,
      "priceDisplay": "14 - 18 €",
      "schedule": "Vie 18 (Copérnico 20:30h) y Sáb 19 (El Sol 21:00h)",
      "summary": "Trap experimental, sintetizadores y post-punk en los templos del clubbing del centro.",
      "description": "El ciclo MAZO reúne a los artistas más inquietos del panorama emergente nacional con total inmediatez física.",
      "tip": "La sesión del sábado de CORTE! en El Sol te sitúa en pleno centro a escasos minutos a pie de Sol."
    },
    {
      "id": "personas-lugares",
      "title": "Personas, Lugares y Cosas (Estreno Teatral)",
      "category": "escena",
      "categoryName": "Drama Británico",
      "location": "Teatro Español (Plaza de Santa Ana)",
      "lat": 40.4147,
      "lng": -3.7009,
      "transit": "5 min a pie desde Sol",
      "priceMin": 6,
      "priceMax": 22,
      "priceDisplay": "6 - 22 €",
      "schedule": "Sábado 19 y Domingo 20 de Septiembre (19:00 h)",
      "summary": "El aclamado éxito londinense de Duncan Macmillan con un montaje de sobrecarga sensorial.",
      "description": "Una inmersión teatral en el proceso de adicción y desintoxicación contemporáneo en la Sala Principal del teatro más antiguo de Europa.",
      "tip": "Las entradas en butaca de paraíso son especialmente asequibles (desde 6 €) y gozan de excelente acústica."
    },
    {
      "id": "alcala-31",
      "title": "Sala Alcalá 31: Fotografía Contemporánea",
      "category": "arte",
      "categoryName": "Fotografía Pop",
      "location": "Calle de Alcalá, 31",
      "lat": 40.418,
      "lng": -3.6995,
      "transit": "6 min a pie desde Sol",
      "priceMin": 0,
      "priceMax": 0,
      "priceDisplay": "Gratuito",
      "schedule": "Vie y Sáb: 11:00 a 20:30 h | Dom: 11:00 a 14:00 h",
      "summary": "Muestra bajo la monumental bóveda bancaria de Antonio Palacios con acceso libre.",
      "description": "Imágenes de transgresión, retrato y estética pop en uno de los espacios expositivos más bellos del centro histórico de Madrid.",
      "tip": "Combínalo con un paseo posterior por las terrazas de la calle Sevilla o Canalejas."
    },
    {
      "id": "fundacion-telefonica",
      "title": "Espacio Telefónica: Fotografía & Retratos",
      "category": "arte",
      "categoryName": "Cultura Digital",
      "location": "Calle de Fuencarral, 3 (Gran Vía)",
      "lat": 40.4205,
      "lng": -3.7018,
      "transit": "7 min a pie (Metro Gran Vía)",
      "priceMin": 0,
      "priceMax": 0,
      "priceDisplay": "Gratuito",
      "schedule": "Viernes a Domingo: 10:00 a 20:00 h",
      "summary": "Instalaciones visuales y tecnología en el rascacielos histórico de Telefónica.",
      "description": "Plataforma de arte y reflexión digital en pleno cruce de Gran Vía y Fuencarral, con exposiciones temporales y colección de aparatos de comunicación antiguos.",
      "tip": "Sube a su espectacular escalera helicoidal para fotografiar una de las joyas del art déco madrileño."
    },
    {
      "id": "addams-musical",
      "title": "La Familia Addams, El Musical (Estreno)",
      "category": "escena",
      "categoryName": "Gran Musical",
      "location": "Teatro Calderón (Calle Atocha 18)",
      "lat": 40.4137,
      "lng": -3.7025,
      "transit": "6 min a pie (Metro Tirso de Molina)",
      "priceMin": 25,
      "priceMax": 65,
      "priceDisplay": "25 - 65 €",
      "schedule": "Viernes 20h | Sábado 17:30 y 21h | Domingo 18h",
      "summary": "Superproducción con orquesta en directo, números corales de jazz y escenografía gótica.",
      "description": "El clan Addams aterriza con un montaje de gran escala cargado de comedia corrosiva y vestuario teatral deslumbrante.",
      "tip": "La sesión del sábado a las 21:00 h te permite cenar de tapas por La Latina justo al salir."
    },
    {
      "id": "circulo-bellas-artes",
      "title": "Azotea y Salas del Círculo de Bellas Artes",
      "category": "arte",
      "categoryName": "Mirador & Exposiciones",
      "location": "Calle de Alcalá, 42",
      "lat": 40.4184,
      "lng": -3.6968,
      "transit": "8 min a pie (Metro Sevilla o Banco de España)",
      "priceMin": 5,
      "priceMax": 5,
      "priceDisplay": "~5,00 €",
      "schedule": "Viernes a Domingo: 11:00 a 01:00 h",
      "summary": "Mirador panorámico de 360 grados sobre los tejados del centro y la Gran Vía.",
      "description": "Bajo la estatua de Minerva se contempla la calle de Alcalá y el edificio Metrópolis. El ticket incluye acceso a las exposiciones de artes plásticas.",
      "tip": "La luz de media tarde es la más fotogénica para capturar la Gran Vía en perspectiva."
    },
    {
      "id": "mercado-ranas",
      "title": "Mercado de las Ranas (Edición Especial)",
      "category": "airelibre",
      "categoryName": "Mercado Callejero",
      "location": "Barrio de las Letras (Calle Huertas)",
      "lat": 40.4132,
      "lng": -3.6991,
      "transit": "7 min a pie (Metro Antón Martín)",
      "priceMin": 0,
      "priceMax": 0,
      "priceDisplay": "Gratuito",
      "schedule": "Sábado 19 de Septiembre (11:00 a 20:00 h)",
      "summary": "Artesanos, diseñadores e ilustradores sacan sus creaciones a las aceras peatonales.",
      "description": "Inspirado en mercados como Portobello, los anticuarios y locales organizan puestos al aire libre con música acústica y versos en el suelo.",
      "tip": "Empieza a las 12:30 h combinándolo con un vermut de grifo en las tabernas de la calle Huertas."
    },
    {